title,network,country,classification,start_date,seasons,status,rating,votes,cast,description,tv_comedies,crime_tv_shows,tv_dramas,docuseries,teen_tv_shows,tv_horror,kids_tv,romantic_tv_shows,science_nature_tv,british_tv_shows,tv_action_adventure,anime_series,reality_tv,tv_mysteries,tv_scifi_fantasy
Transformers: Robots in Disguise,Cartoon Network,US,TV-Y7,2015-03-14,1,Ended,6.0,822,"Will Friedle, Darren Criss, Constance Zimmer, Khary Payton, Mitchell Whitfield, Stuart Allan, Ted McGinley, Peter Cullen","When a prison ship crash unleashes hundreds of Decepticons on Earth, Bumblebee leads a new Autobot force to protect humankind.",0,0,0,0,0,0,1,0,0,0,0,0,0,0,0
No Tomorrow,The CW,US,TV-14,2016-10-04,1,Ended,7.2,4684,"Joshua Sasse, Tori Anderson, Jonathan Langdon, Sarayu Blue, Jesse Rath, Amy Pietz","Her straitjacketed life turned topsy-turvy by hunky Xavier, Evie discovers a new freedom – even though her man just might be an end-of-days crackpot.",1,0,1,0,0,0,0,1,0,0,0,0,0,0,0
Frequency,The CW,US,TV-14,2016-10-05,1,Ended,7.5,12563,"Peyton List, Riley Smith, Mekhi Phifer, Devin Kelley, Lenny Jacobson, Daniel Bonjour, Anthony Ruivivar","A detective seizes a precious opportunity to change the past when she finds she can communicate with her deceased, estranged father via a time warp.",0,1,1,0,0,0,0,0,0,0,0,0,0,1,0
Adam Ruins Everything,truTV,US,TV-14,2015-09-29,1,Ended,8.0,6108,"Adam Conover, Adam Lustick, Emily Axford","Education can be fun – and funny. Comedian Adam Conover bursts misconceptions, deconstructs topics and leaves with positive takeaways.",1,0,0,0,0,0,0,0,0,0,0,0,0,0,0
Ben 10,Cartoon Network,US,TV-Y7,2005-12-27,1,Ended,7.2,12412,"Tara Strong, Montse Hernandez, David Kaye, Roger Craig Smith, Todd Haberkorn, Dwight Schultz, Daryl Sabara",Ben can transform into ten types of aliens. He'll try 'em all while adventuring across the country with his cousin Gwen and Grandpa Max.,0,0,0,0,0,0,1,0,0,0,0,0,0,0,0
The Royal House of Windsor,Channel 4,GB,TV-14,2017-02-22,1,Ended,7.4,906,Unknown,"Drawing on newly available info, this show traces how the British royal family has survived the last 100 years of power struggles, politics and more.",0,0,0,1,0,0,0,0,0,1,0,0,0,0,0
Lovesick,Netflix,UK,TV-14,2014-10-02,1,Ended,8.1,15245,"Kongyingyong Chonlathorn, Phumphothingam Nawat, Luangsodsai Anupart, Nuchanart Veerakaarn, Chindavanich Primrose, Charnmanoon Pannin, Nungira Hanwutinanon, Ausavaterakul Ausavapat, Sirikiet Saejea, Nontapan Chuenwarin",Love and academics get complicated at an all-male college that happens to be located next to an all-female high school.,0,0,1,0,0,0,0,1,0,0,0,0,0,0,0
Bard of Blood,Netflix,US,TV-MA,2019-09-27,1,To Be Determined,7.0,8713,"Emraan Hashmi, Viineet Kumar, Sobhita Dhulipala, Jaideep Ahlawat, Kirti Kulhari, Sohum Shah, Rajit Kapoor, Danish Hussain","Years after a disastrous job in Balochistan, a former Indian spy must confront his past when he returns to lead an unsanctioned hostage-rescue mission.",0,0,1,0,0,0,0,0,0,0,1,0,0,0,0
Skylines,Netflix,US,TV-MA,2019-09-27,1,Ended,7.6,2058,"Edin Hasanovic, Peri Baumeister, Murathan Muslu, Erdal Yıldız, Richy Müller, Anna Herrmann, Sahin Eryilmaz, Lisa Maria Potthoff, Carol Schuler, Dustin Jérôme Schanz, Nimo, Christopher Schärf, Slavko Popadic",A hip-hop producer gets hurled into the violent world of organized crime when the record label he signs to becomes the center of a deadly drug business.,0,1,1,0,0,0,0,0,0,0,0,0,0,0,0
The Politician,Netflix,UK,TV-14,2019-09-27,1,Running,7.6,17253,"Ben Platt, Gwyneth Paltrow, Jessica Lange, Zoey Deutch, Lucy Boynton, Bob Balaban, David Corenswet, Julia Schlaepfer, Laura Dreyfuss, Theo Germaine, Rahne Jones, Benjamin Barrett",Rich kid Payton has always known he's going to be president. But first he has to navigate the most treacherous political landscape of all: high school.,1,0,1,0,1,0,0,0,0,0,0,0,0,0,0
Team Kaylie,Netflix,US,TV-PG,2019-09-23,1,Running,4.1,199,"Bryana Salaz, Alison Fernandez, Symera Jackson, Elie Samouhi, Kai Calhoun, Eliza Pryor, Rosa Blasi, Nicole Sullivan, David Gridley","After a brush with the law, teen celebrity Kaylie Konrad swaps social stardom for court-ordered chaos as a middle school wilderness club leader.",1,0,0,0,0,0,1,0,0,0,0,0,0,0,0
Hilda,Netflix,US,TV-Y7,2018-09-21,1,To Be Determined,8.6,5726,"Bella Ramsey, Ameerah Falzon-Ojo, Oliver Nelson, Daisy Haggard, Rasmus Hardiker","Fearless, free-spirited Hilda finds new friends, adventure and magical creatures when she leaves her enchanted forest home and journeys to the city.",0,0,0,0,0,0,1,0,0,0,0,0,0,0,0
The Good Cop,Netflix,US,TV-PG,2018-09-21,1,Ended,7.0,4707,"Tony Danza, Josh Groban, Monica Barbaro, Isiah Whitlock Jr.","When he's not solving murders, a pathologically honest detective tries to keep an eye on his crooked but kindhearted dad.",1,1,1,0,0,0,0,0,0,0,0,0,0,0,0
Criminal: France,Netflix,US,TV-MA,2019-09-20,1,Ended,7.2,2892,"Margot Bancilhon, Laurent Lucas, Stéphane Jobert, Anne Azoulay, Mhamed Arezki, Sara Giraudeau, Nathalie Baye, Jérémie Renier","Secrets emerge and entire cases unravel inside a police interview room in Paris, where suspects and investigators face off in an intricate dance.",0,1,1,0,0,0,0,0,0,0,0,0,0,0,0
Criminal: Germany,Netflix,US,TV-MA,2019-09-20,1,Ended,7.7,3737,"Eva Meckbach, Sylvester Groth, Florence Kasumba, Peter Kurth, Christian Berkel, Nina Hoss, Christian Kuchenbuch, Jonathan Berlin, Deniz Arora","In the interview room, detectives go head-to-head with suspects and try to get to the truth – even if it means breaking the rules and risking it all.",0,1,1,0,0,0,0,0,0,0,0,0,0,0,0
Two Sentence Horror Stories,The CW,US,TV-14,2019-08-08,1,Running,5.6,898,"Nicole Kang, Jim Parrack, Tara Pacheco, Christopher Shyer, Kimberley Wong, Wai Ching Ho, Greta Quispe, Zaria Degenhardt, Uly Schlesinger, Kate Jennings Grant, Aleyse Shannon, Guillermo Arribas, Jaiden Smith, Pepper Binkley, Mikelle Wright-Matos, Melinda Mo",This anthology series of terror features diverse characters facing primal fears in spine-chilling situations that stretch past daily routine.,0,0,0,0,1,1,0,0,0,0,0,0,0,0,0
Chef's Table: France,Netflix,US,TV-14,2016-09-02,1,Ended,8.3,1486,Unknown,Sample the bold new flavors of France with chefs who are pushing the boundaries of fine dining and reinventing a rich culinary tradition.,0,0,0,1,0,0,0,0,0,0,0,0,0,0,0
Transformers: Rescue Bots,Discovery Family,US,TV-Y7,2011-12-11,1,Ended,6.5,733,"Lacey Chabert, Elan Garfias, Maurice LaMarche, Jason Marsden, Shannon McKain, Steve Blum, Parvesh Cheena, D.C. Douglas, Imari Williams, LeVar Burton, Diamond White","Follow the adventure of four young transformers, Heatwave, Chase, Blades and Boulder, and their human counterparts: a family of emergency responders.",0,0,0,0,0,0,1,0,0,0,0,0,0,0,0
Manhunt,Spectrum On Demand,US,TV-14,2017-08-01,1,Running,7.4,3555,"Sam Worthington, Paul Bettany, Chris Noth, Jeremy Bobb, Ben Weber, Lynn Collins, Brían F. O'Byrne, Keisha Castle-Hughes, Mark Duplass, Elizabeth Reaser, Diesel Madkins","Faced with few clues and an increasingly panicked public, the FBI calls on a new kind of profiler to help track down the infamous Unabomber.",0,1,1,0,0,0,0,0,0,0,0,0,0,1,0
Ancient Aliens,History,US,TV-PG,2010-04-20,1,Running,7.3,9270,Robert Clotworthy,"Were ancient humans really behind some of the most important technological advances in civilized history, or did they have extraterrestrial help?",0,0,0,1,0,0,0,0,1,0,0,0,0,0,0
The Last Kids on Earth,Netflix,US,TV-Y7-FV,2019-09-17,1,Running,7.5,710,"Nick Wolfhard, Charles Demers, Garland Whitt, Montse Hernandez, Brian Drummond, Giles Panton, Keith David","When zombies and monsters invade his hometown, a scrappy 13-year-old orphan teams up with his friends in hopes of surviving the chaos.",1,0,0,0,0,0,1,0,0,0,0,0,0,0,0
America's Book of Secrets,H2,US,TV-14,2012-01-21,1,Ended,6.8,660,Jonathan Adams,"This engaging documentary series shares the surprising backstories of familiar institutions like the Pentagon, West Point and the Playboy Mansion.",0,0,0,1,0,0,0,0,0,0,0,0,0,0,0
Cold Case Files,A&E,US,TV-14,2017-02-27,1,Running,8.0,1397,Unknown,Masterful detectives utilize forensic science and criminal psychology to re-examine long-standing cases.,0,1,0,1,0,0,0,0,0,0,0,0,0,0,0
The Curse of Oak Island,History,US,TV-PG,2014-01-05,1,Running,7.1,4008,Robert Clotworthy,"On an ominous island off of Nova Scotia, two brothers chase historical theories on a quest for enigmatic treasure.",0,0,0,1,0,0,0,0,0,0,0,0,0,0,0
The Rap Game,Lifetime,US,TV-14,2016-01-01,1,Running,5.4,114,Jermaine Dupri,Young lyricists between the ages of 12 and 16 compete for a chance to sign to Jermaine Dupri's label while being mentored by hip-hop and R&B's finest.,0,0,0,0,0,0,0,0,0,0,0,0,1,0,0
The Universe,H2,US,TV-PG,2007-05-29,1,Ended,8.8,5024,Erik Thompson,"Discover the secrets of the universe in this series that pairs animation with insights on distant planets, black holes and other celestial marvels.",0,0,0,1,0,0,0,0,1,0,0,0,0,0,0
Al Hayba,MBC1,SA,TV-14,2017-05-27,1,Running,7.5,786,"Taim Hasan, Nadine Nassib Njeim, Abdo Chahine, Oweiss Mkhallalati, Mona Wassef","In a village by the Lebanon-Syria border, the head of an arms-smuggling clan contends with family conflicts, power struggles and complicated love.",0,1,1,0,0,0,0,0,0,0,0,0,0,0,0
The Five,Sky 1,GB,TV-MA,2016-04-15,1,Ended,6.4,860,"Tom Cullen, O.T. Fagbenle, Lee Ingleby, Sarah Solemani, Hannah Arterton, Geraldine James, Michael Maloney, Rade Serbedzija, Jonathan Kerrigan, Don Warrington, Sophia La Porta","Twenty years after 5-year-old Jesse disappears near his home, his DNA turns up at the scene of a woman's murder, baffling his family and the police.",0,1,1,0,0,0,0,0,0,1,0,0,0,0,0
Norm Macdonald Has a Show,Netflix,US,TV-MA,2018-09-14,1,Ended,8.7,2820,Unknown,Comedian Norm Macdonald hosts his celebrity friends for casual conversations that range from silly to serious and take many unexpected turns.,1,0,0,0,0,0,0,0,0,0,0,0,0,0,0
Marianne,Netflix,NL,TV-MA,2019-09-13,1,Ended,7.5,11037,"Victoire Du Bois, Lucie Boujenah, Tiphaine Daviot, Ralph Amoussou, Bellamine Abdelmalek, Mehdi Meskar, Alban Lenoir, Mireille Herbstmeyer, Corinne Valancogne, Patrick d'Assumçao, Pierre Aussedat","Lured back to her hometown, a famous horror writer discovers that the evil spirit who plagues her dreams is now wreaking havoc in the real world.",0,0,1,0,0,1,0,0,0,0,0,0,0,0,0
Monarca,Netflix,US,TV-MA,2019-09-13,1,Running,8.0,1281,"Irene Azuela, Juan Manuel Bernal, Osvaldo Benavides, Rosa María Bianchi, Antonio de la Vega, Luis Rábago, Sophie Gómez, James Hyde, Carla Adell, Regina Pavón, Dalí González, Alejandro de Hoyos Parera, José Manuel Rincón, Daniela Schmidt, Gabriela de la Garza","After 20 years, Ana María returns to Mexico and vies for control of her family's tequila empire as it threatens to crumble under corruption and secrets.",0,0,1,0,0,0,0,0,0,0,0,0,0,0,0
Top Boy,Netflix,UK,TV-MA,2019-09-13,1,To Be Determined,8.4,12185,"Ashley Walters, Kane Robinson, Micheal Ward, Shone Romulus, Simbiatu Ajikawo, Lisa Dwan, David Omoregie, Jasmine Jobson, Hope Ikpoku Jr., Araloyin Oshunremi, Keiyon Cook","Two seasoned drug dealers return to the gritty streets of London, but their pursuit of money and power is threatened by a young and ruthless hustler.",0,1,0,0,0,0,0,0,0,1,0,0,0,0,0
The I-Land,Netflix,US,TV-MA,2019-09-12,1,Ended,4.5,14068,"Natalie Martinez, Kate Bosworth, Ronald Peet, Kyle Schmid, Alex Pettyfer, Sibylla Deen, Gilles Geary, Anthony Lee Medina, Kota Eberhardt, Michelle Veintimilla, Bruce McGill","Wiped clean of memories and thrown together, a group of strangers fight to survive harsh realities – and the island that traps them.",0,0,1,0,0,0,0,0,0,0,1,0,0,0,1
Life,NBC,US,TV-MA,2007-09-26,1,Ended,8.3,32322,"Lee Dong-wook, Cho Seung-woo, Won Jin-ah, Lee Kyu-hyung, Moon Sung-keun, Yoo Jae-myung, Moon So-ri, Chun Ho-jin","At Korea's top university medical center, ideals and interests collide between a patient-centered ER doctor and the hospital's newly-appointed CEO.",0,0,1,0,0,0,0,0,0,0,0,0,0,0,0
Serial Killer with Piers Morgan,ITV,GB,TV-14,2017-11-16,1,To Be Determined,3.8,1148,Piers Morgan,"Through intense prison interviews, Piers Morgan revisits the crimes of three convicted serial killers and learns more about their motives.",0,1,0,1,0,0,0,0,0,1,0,0,0,0,0
Transformers: Cyberverse,Cartoon Network,US,TV-Y7,2018-09-01,1,Running,6.9,220,"Sophia Isabella, Jeremy Levy, Jacob Tillman, Ryan Andes, Deanna McGovern, Dick Terhune",Optimus Prime and the AllSpark are missing – and only a memory-scrambled Bumblebee holds the key to finding them in this animated sci-fi series.,0,0,0,0,0,0,1,0,0,0,0,0,0,0,0
Sisters,Network 10,AU,TV-MA,2017-10-25,1,Ended,7.5,1785,"Lucy Durack, Antonia Prebble, Maria Angelico, Dan Spielman, Charlie Garber, Lindsay Farris, Zindzi Okenyo, Catherine McClements, Roy Billing, Magda Szubanski",Her dad's deathbed confession leads Julia to discover she has more than 100 brothers and two sisters: troubled TV star Roxy and uptight lawyer Edie.,1,0,1,0,0,0,0,0,0,0,0,0,0,0,0
Conspiracy,Channel 5,UK,TV-14,2015-06-12,1,Ended,6.2,246,Mark Bazeley,"Skeptics and others discuss widely held conspiracy theories involving aliens, government cover-ups, secret assassinations and other intrigues.",0,0,0,1,0,0,0,0,0,1,0,0,0,0,0
Nowhere Man,Netflix,US,TV-MA,2019-10-31,1,To Be Determined,8.4,1638,"Alyssa Chia, Mavis Fan, Joseph Chang, Wang Po-chieh, Jeremiah Zhang, Chou Min-fu, Greg Hsu, Kuo Tze-cheng, Shen Hai-jung, Lu Yi-long","Two nefarious schemes taking place 10 years apart entangle a dauntless triad member, who must break out of prison to rescue a loved one.",0,1,0,0,0,0,0,0,0,0,1,0,0,0,0
Zumbo's Just Desserts,Seven Network,AU,TV-14,2016-08-22,1,Running,6.9,1768,"Adriano Zumbo, Rachel Khoo","Dessert wizard Adriano Zumbo looks for the next “Willy Wonka” in this tense competition that finds skilled amateurs competing for a $100,000 prize.",0,0,0,0,0,0,0,0,0,0,0,0,1,0,0
Seis Manos,Netflix,US,TV-MA,2019-10-03,1,To Be Determined,7.3,931,"Aislinn Derbez, Mike Colter, Jonny Cruz, Angélica Vale, Vic Chao, Danny Trejo","Orphans raised by a martial arts master are plunged into a mystery involving demonic powers, drug cartels, ancient rituals and blood sacrifice.",0,1,0,0,0,0,0,0,0,0,0,1,0,0,0
Brotherhood,SHOWTIME,US,TV-MA,Jul/09/2006,1,Canceled,7.7,6757,"Naruna Costa, Seu Jorge, Hermila Guedes, Lee Taylor, Danilo Grangheia, Wesley Guimarães, Pedro Wagner","An honest lawyer reaches a moral crossroads after the cops force her to inform on her incarcerated brother, the leader of a rising criminal faction.",0,1,1,0,0,0,0,0,0,0,0,0,0,0,0
Prank Encounters,Netflix,US,TV-MA,2019-10-25,1,To Be Determined,5.1,1843,Gaten Matarazzo,Monstrous frights meet hilarious reveals on this hidden-camera prank show as real people become the stars of their own full-blown horror movie.,1,0,0,0,0,1,0,0,0,0,0,0,1,0,0
Daybreak,Netflix,US,TV-MA,2019-10-24,1,Ended,6.7,14289,"Colin Ford, Alyvia Alyn Lind, Sophie Simnett, Austin Crute, Cody Kearsley, Jeanté Godlock, Gregory Kasyan, Krysta Rodriguez, Matthew Broderick","Living his best life in post-apocalyptic LA, a slacker strives to find the girl of his dreams while outwitting mindless ghouls and cliquish gangs.",1,0,0,0,0,1,0,0,0,0,1,0,0,0,0
Containment,The CW,US,TV-14,2016-04-19,1,Ended,7.2,9942,"David Gyasi, Christina Marie Moses, Chris Wood, Kristen Gutoskie, Claudia Black, George Young, Hanna Mangan Lawrence, Trevor St. John","When a ferocious contagion sweeps through Atlanta, authorities impose a precarious quarantine on the city while scrambling to find a cure.",0,0,1,0,0,0,0,0,0,0,0,0,0,0,0
Accidentally in Love,Tencent QQ,CN,TV-14,2018-08-08,1,Ended,7.6,691,"Junchen Guo, Yi Ning Sun, Yi Qin Zhao, Mu Xuan Cheng, Li Ma, Mo Zhou","Rejecting the demands of her wealthy family, a young woman poses as an ordinary college student and crosses paths with a stoic pop star at school.",1,0,0,0,0,0,0,1,0,0,0,0,0,0,0
Wanderlust,BBC One,GB,TV-MA,2018-09-04,1,Ended,7.0,4287,"Toni Collette, Steven Mackintosh, Zawe Ashton, Joe Hurst, Emma D'Arcy, Celeste Dring, William Ash, Royce Pierreson, Jeremy Swift, Anastasia Hille, Isis Hainsworth, Sophie Okonedo","Unable to revive their fading sex life after many years of marriage, a therapist and her husband decide to start dating other people.",0,0,0,0,0,0,0,1,0,1,0,0,0,0,0
Unnatural Selection,Netflix,US,TV-MA,2019-10-18,1,To Be Determined,8.0,1239,Unknown,"From eradicating disease to selecting a child’s traits, gene editing gives humans the chance to hack biology. Meet the real people behind the science.",0,0,0,1,0,0,0,0,1,0,0,0,0,0,0
Spotless,Canal+,FR,TV-MA,2015-03-16,1,Ended,7.9,3045,"Marc-André Grondin, Denis Ménochet, Miranda Raison, Doug Allen, Liam Garrigan, Ciarán Owens, Kate Magowan, Tanya Fear, Naomi Radcliffe, Lucy Akhurst, Jemma Donovan, Niall Hayes, Brendan Coyle",The law-abiding owner of a crime scene cleaning service is forced into business with a powerful mob boss thanks to his irresponsible older brother.,0,1,1,0,0,0,0,0,0,0,0,0,0,0,0
The Curious Creations of Christine McConnell,Netflix,US,TV-PG,2018-10-12,1,Ended,7.7,2124,"Christine McConnell, Colleen Smith, Adam Mayfield, Michael Oosterom, Drew Massey, Mick Ignis, Tim Lagasse, Dita von Teese, Steven M. Porter, Elko Weaver","Wickedly talented baker and artist Christine McConnell fills her home with haunting confections, creepy crafts – and wildly inappropriate creatures.",1,0,0,0,0,0,0,0,0,0,0,0,0,1,0
Cheese in the Trap,tvN,KR,TV-14,2016-01-04,1,Ended,7.4,2668,"Park Hae-Jin, Kim Go-eun, Seo Kang-jun, Lee Sung-kyoung, Nam Joo-hyuk, Park Min-ji, Hwang Seog-jeong, Son Byung-ho, Ahn Kil-kang","In this adaptation of a popular webtoon, a poor student trying to navigate college life gains the attention of a wealthy upperclassman with a dark side.",0,0,0,0,0,0,0,1,0,0,0,0,0,0,0
The K2,tvN,KR,TV-14,2016-09-23,1,Ended,7.8,3086,"Ji Chang-wook, Song Yoon-a, Lim Yoona, Cho Seong-ha, Kim Kap-soo, Lee Jung-jin, Son Tae-young, Shin Dong-mi",A fugitive soldier gets swept up in personal and political intrigue when he's hired as a bodyguard for the family of a presidential candidate.,0,0,0,0,0,0,0,1,0,0,0,0,0,0,0
Hot Date,Pop,US,TV-MA,2017-11-08,1,Running,7.0,511,"Emily Axford, Brian Murphy",Interconnected sketches and performances skewer the madness and misunderstandings of modern relationships.,1,0,0,0,0,0,0,1,0,0,0,0,0,0,0
The Code,CBS,US,TV-MA,2019-04-09,1,Ended,7.4,3732,"Dan Spielman, Ashley Zukerman, Adele Perovic, Adam Garcia, Chelsie Preston Crayford, Paul Tassone, Dan Wyllie, Lucy Lawless, Aden Young, David Wenham","Investigating a deadly car crash, a journalist and his hacker brother stumble into a conspiracy that reaches into the upper echelons of government.",0,1,1,0,0,0,0,0,0,0,0,0,0,0,0
Robotech,MBS,AJ,TV-MA,1985-03-04,1,Ended,8.5,3350,"Jean-Claude Ballard, Gregory Snegoff, Cam Clarke, Melissa Newman, Tony Oliver, Larry Abraham, Robert Axelrod, Robert V. Barron","When a mysterious spaceship crashes in the Pacific, the people of Earth work to master the science of robotechnology and rebuild the giant fortress.",0,0,0,0,0,0,0,0,0,0,0,1,0,0,0
Medal of Honor,Netflix,US,TV-MA,2018-11-09,1,To Be Determined,8.4,1319,"Oliver Hudson, Ben Schwartz, Paul Wesley, Aldis Hodge, Jonny Weston, Joseph Cross, Jake Abel, Derek Mio","Honoring service members whose courage merited the awarding of a Medal of Honor, this docudrama series re-creates their inspiring true stories.",0,0,1,1,0,0,0,0,0,0,0,0,0,0,0
Super Drags,Netflix,US,TV-MA,2018-11-09,1,Ended,5.6,1307,"Fernando Mendonça, Sérgio Cantú, Wagner Follare, Pabllo Vittar, Silvetty Montilla, Rapha Vélez, Sylvia Salustti, Guilherme Briggs","In this adult animated series, three gay co-workers lead double lives as drag queen superheroes, saving the LGBTQ community from evil nemeses.",1,0,0,0,0,0,0,0,0,0,0,0,0,0,0
Westside,Three,NZ,TV-MA,2015-05-31,1,Running,8.0,449,Unknown,Nine struggling musicians share the spotlight in this deeply personal reality series about the challenges and thrills of staging a Hollywood showcase.,0,0,0,0,0,0,0,0,0,0,0,0,1,0,0
Case,Stöð 2,IS,TV-MA,2015-10-18,1,Ended,7.1,2075,"Steinunn Ólína Þorsteinsdóttir, Magnús Jónsson, Þorsteinn Bachmann, Jóhanna Vigdís Arnardóttir, Birna Rún Eiríksdóttir, Elma Stefania Agustsdottir, Bergur Þór Ingólfsson, Halldóra Geirharðsdóttir, Arnar Jónsson, Davíð Freyr Þórunnarson, Björn Stefánsson, Nína Dögg Filippusdóttir, Hjortur Jóhann Jónsson",A smart lawyer whose drinking and recklessness send him on a path of self-destruction finds new purpose investigating a teenager's apparent suicide.,0,1,1,0,0,0,0,0,0,0,0,0,0,0,0
Green Eggs and Ham,Netflix,US,TV-Y7,2019-11-08,1,Running,8.2,1696,"Michael Douglas, Adam Devine, Keegan-Michael Key, Eddie Izzard, Jillian Bell, Ilana Glazer, Diane Keaton, Jeffrey Wright, John Turturro, Tracy Morgan, Daveed Diggs","On a road trip to save an endangered animal, polar opposites Guy and Sam learn to try new things like friendship – and a certain delectable dish.",1,0,0,0,0,0,1,0,0,0,1,0,0,0,0
Damnation,USA Network,AU,TV-14,2017-11-07,1,Ended,7.7,6524,"Logan Marshall-Green, Killian Scott, Sarah Jones, Chasten Harmon, Christopher Heyerdahl, Melinda Page Hamilton, Joe Adler","During the Great Depression, a stranger with a violent past poses as a preacher and rallies farmers to mount a strike in a rural Iowa community.",0,1,1,0,0,0,0,0,0,0,0,0,0,0,0
Chocolate,jTBC,KR,TV-14,2019-11-29,1,Ended,7.7,640,"Ha Ji-won, Yoon Kye-sang, Jang Seung-jo, Kang Bu-ja, Lee Jae-ryong, Min Jin-woong, Kim Won-hae, Yoo Teo","Brought together by meaningful meals in the past and present, a doctor and a chef are reacquainted when they begin working at a hospice ward.",0,0,0,0,0,0,0,1,0,0,0,0,0,0,0
Cloudy with a Chance of Meatballs,Cartoon Network,US,TV-Y7,2017-02-20,1,Running,3.3,618,"Mark Edwards, Katie Griffin, Seán Cullen, David Berni, Clé Bennett, Patrick McKenna","Teenager Flint Lockwood has a knack for invention. With help from his pal Sam Sparks, he might even change the world – if he doesn't break it first.",1,0,0,0,0,0,1,0,0,0,0,0,0,0,0
Sugar Rush Christmas,Netflix,US,TV-PG,2019-11-29,1,Running,6.9,254,"Hunter March, Candace Nelson, Adriano Zumbo","It's everything you love about ""Sugar Rush"" – with a holly jolly holiday twist – in this Christmas-themed spin on competitive baking.",0,0,0,0,0,0,0,0,0,0,0,0,1,0,0
The Movies That Made Us,Netflix,US,TV-MA,2019-11-29,1,Running,7.8,2451,Unknown,"These blockbusters brought us together and gave us the time of our lives. Meet the actors, directors and industry insiders who made them happen.",0,0,0,1,0,0,0,0,0,0,0,0,0,0,0
Levius,Netflix,US,TV-14,2019-11-28,1,To Be Determined,7.1,352,"Nobunaga Shimazaki, Junichi Suwabe, Takahiro Sakurai, Ayane Sakura, Hochu Otsuka, Daisuke Ono, Saori Hayami, Mamoru Miyano",Young Levius rises through the ranks in the brutal world of metal boxing under his uncle's guidance. Forces outside the ring have their eye on him.,0,0,0,0,0,0,0,0,0,0,0,1,0,0,0
Broken,BBC One,GB,TV-14,2017-05-30,1,Ended,8.1,2459,Unknown,This investigative docuseries shows how negligence and deceit in the production and marketing of popular consumer items can result in dire outcomes.,0,0,0,1,0,0,0,0,0,0,0,0,0,0,0
Dirty John,USA Network,US,TV-14,2018-11-25,1,To Be Determined,7.2,14768,"Connie Britton, Eric Bana, Juno Temple, Julia Garner, Jean Smart, Keiko Agena, Jeff Perry, Kevin Zegers, Jake Abel",Businesswoman Debra Newell's life unravels when she falls for the lies and manipulation of con man John Meehan. Based on the true-crime podcast.,0,1,1,0,0,0,0,0,0,0,0,0,0,1,0
The Final Table,Netflix,US,TV-PG,2018-11-20,1,Ended,7.7,3009,Andrew Knowlton,Teams of elite chefs vie to impress the world's toughest palates as they whip up iconic dishes from nine nations in this star-packed competition.,0,0,0,0,0,0,0,0,0,0,0,0,1,0,0
Bella and the Bulldogs,Nickelodeon,US,TV-G,2015-01-17,1,Ended,5.3,1377,"Brec Bassinger, Coy Stewart, Jackie Radinsky, Buddy Handleson, Lilimar, Haley Tju, Dorien Wilson, Rio Mangini, Annie Tedesco","The life of cheerleader Bella Dawson turns upside down when, in a twist of fate, she becomes quarterback for her middle school's football team.",1,0,0,0,0,0,1,0,0,0,0,0,0,0,0
Brainchild,Netflix,US,TV-Y7,2018-11-02,1,To Be Determined,7.9,294,"Sahana Srinivasan, Alie Ward, Ben Seidman","From germs and emotions to social media and more, it's the science of your world explained in a way that's refreshingly relatable.",0,0,0,0,0,0,1,0,0,0,0,0,0,0,0
La Doña,Telemundo,US,TV-14,2016-11-24,1,Running,6.8,500,"Aracely Arámbula, David Chocarro, Danna Paola, Rebecca Jones, Odiseo Bichir, Gabriela Roel, Andrea Martí, Juan Ríos Cantú, Diego Soldano, Daniela Bascopé","Worlds collide and lives shatter when Altagracia, a powerful and elegant businesswoman, plots a ruthless revenge while falling in love.",0,0,1,0,0,0,0,0,0,0,0,0,0,0,0
Silvana Sin Lana,Telemundo,US,TV-14,2016-07-19,1,Ended,7.4,251,"Maritza Rodríguez, Carlos Ponce, Marimar Vega, Adriana Barraza, Marcela Guirado, Ricardo Abarca, Thali García, Alexandra Pomales, Briggitte Bozzo, Santiago Torres, Patricio Gallardo, Roberto Escobar, Samantha Dagnino, Raury Rolander, Vince Miranda, Javier Valcárcel","When her fugitive husband leaves her homeless and penniless, a once-wealthy woman has no other choice but to join the working class.",1,0,0,0,0,0,0,1,0,0,0,0,0,0,0
The Stranded,Netflix,US,TV-MA,2019-11-15,1,To Be Determined,6.3,880,"Papangkorn Lerkchaleampote, Chayanit Chansangavej, Chutavuth Pattarakampol, Kittisak Patomburana, Sinjai Plengpanich, Oabnithi Wiwattanawarang, Ticha Wongthipkanont, Chaleeda Gilbert, Chanya McClory","Trapped on an island destroyed by a tsunami, the students of an elite school try to hold on to hope. But mysterious forces seem to work against them.",0,0,1,0,0,0,0,0,0,0,1,0,0,0,0
