title,network,country,classification,start_date,seasons,status,rating,votes,cast,description,tv_comedies,crime_tv_shows,tv_dramas,docuseries,teen_tv_shows,tv_horror,kids_tv,romantic_tv_shows,science_nature_tv,british_tv_shows,tv_action_adventure,anime_series,reality_tv,tv_mysteries,tv_scifi_fantasy
Sherlock,BBC One,UK,TV-14,2010-07-25,4,To Be Determined,9.1,786109,"Benedict Cumberbatch, Martin Freeman, Una Stubbs, Rupert Graves, Mark Gatiss, Andrew Scott","In this updated take on Sir Arthur Conan Doyle's beloved mystery tales, the eccentric sleuth prowls the streets of modern London in search of clues.",0,1,0,0,0,0,0,0,0,1,0,0,0,0,0
Master of None,Netflix,US,TV-MA,2015-11-06,2,Ended,8.3,64318,"Aziz Ansari, Noël Wells, Eric Wareheim, Lena Waithe, Kelvin Yu, Fatima Ansari, Shoukath Ansari, Alessandra Mastronardi, Bobby Cannavale",Dev tries to jump-start his acting career and elevate his dating game with help from his eclectic group of friends in this award-winning series.,1,0,0,0,0,0,0,0,0,0,0,0,0,0,0
LoliRock,France 3,FR,TV-Y,2014-10-18,2,Running,7.2,294,"Kazumi Evans, Kelly Sheridan, Vincent Tong, Ashleigh Ball, Tabitha St. Germain, Mackenzie Gray, Matt Ellis, James Kirk, Chiara Zanni",A teenager with a beautiful voice becomes a pop star but discovers she has powers that come from a magical realm where she's a lost princess.,0,0,0,0,0,0,1,0,0,0,0,0,0,0,0
Love,Netflix,US,TV-MA,2016-02-19,3,Ended,7.7,36088,"Gillian Jacobs, Paul Rust, Claudia O'Doherty",Rebellious Mickey and good-natured Gus navigate the thrills and agonies of modern relationships in this bold comedy co-created by Judd Apatow.,1,0,1,0,0,0,0,1,0,0,0,0,0,0,0
Hap and Leonard,Sundance TV,US,TV-MA,2016-03-02,3,Ended,7.7,6565,"James Purefoy, Michael Kenneth Williams, Jimmi Simpson, Bill Sage, Christina Hendricks, Pollyanna McIntosh, Jeff Pope, Neil Sandilands, Henry G. Sanders, Enrique Murciano","In late-1980s Texas, two best friends get involved in darkly comic misadventures by hiring themselves out to shady clients for illicit ends.",0,1,1,0,0,0,0,0,0,0,0,0,0,0,0
Secret City,FOXTEL Now,AU,TV-MA,2016-06-05,2,To Be Determined,7.4,5931,"Anna Torv, Jacki Weaver, Dan Wyllie, Alex Dimitriades, Damon Herriman, Mekhi Phifer, Eugenia Yuan, Matt Zeremes, Alan Dale",A student's protest leads to a government scandal that has personal and professional repercussions for one of Australia's toughest journalists.,0,0,1,0,0,0,0,0,0,0,0,0,0,1,0
Rectify,Sundance TV,US,TV-14,2013-04-22,4,Ended,8.3,24015,"Aden Young, Abigail Spencer, J. Smith-Cameron, Clayne Crawford, Luke Kirby, Adelaide Clemens, Jake Austin Walker, Jayson Warner Smith, Bruce McKinnon, J.D. Evermore, Michael O'Neill, Sean Bridgers, Johnny Ray Gill, Sharon Conley, Michael Vartan","Convicted of rape and murder at age 18, Daniel Holden spends nearly 20 years on death row until DNA evidence brings the verdict into question.",0,1,1,0,0,0,0,0,0,0,0,0,0,1,0
Doctor Foster,BBC One,UK,TV-MA,2015-09-09,2,Ended,7.7,14458,"Suranne Jones, Bertie Carvel, Clare-Hope Ashitey, Cheryl Campbell, Jodie Comer, Victoria Hamilton, Martha Howe-Douglas, Adam James, Thusitha Jayasundera, Sara Stewart, Neil Stuke, Tom Taylor, Robert Pugh, Shazia Nicholls, Cian Barry, Megan Roberts, Charlie Cunniffe, Navin Chowdhry","When she suspects her husband is cheating on her, Dr. Gemma Foster starts an investigation that leads her down a dark path of obsession.",0,0,0,0,0,0,0,1,0,1,0,0,0,0,0
Father Brown,BBC One,UK,TV-14,2013-01-14,6,Running,7.7,7709,"Mark Williams, Sorcha Cusack, Nancy Carroll, Alex Price, Hugo Speer, Tom Chambers, Keith Osborn","A modest, compassionate priest doubles as an effective crime solver in this series based on the short stories by G.K. Chesterton.",0,1,1,0,0,0,0,0,0,1,0,0,0,0,0
Yu-Gi-Oh!,WB,AJ,TV-Y7,Sep/29/2001,5,Canceled/Ended,7.2,18096,"Dan Green, Eric Stuart, Amy Birnbaum, Darren Dunstan, Wayne Grayson, Tara Sands, Lisa Ortiz, Megan Hollingshead, Madeleine Blaustein, Sam Riegel, Ted Lewis, Gregory Abbey, Jimmy Zoppi","The lives of young Yugi Moto and his friends Joey, Tristan, and Téa are forever changed when a fantasy card game becomes their reality.",0,0,0,0,0,0,1,0,0,0,0,1,0,0,0
Extras,BBC Two,UK,TV-MA,2005-07-21,2,Ended,8.3,52416,"Ricky Gervais, Stephen Merchant, Ashley Jensen, Shaun Williamson, Shaun Pye","Grasping hungrily for stardom, bit actor Andy Millman and his pal Maggie spend their days chasing after work as film and TV extras.",1,0,0,0,0,0,0,0,0,1,0,0,0,0,0
Republic of Doyle,CBC,CA,TV-14,2010-01-06,6,Ended,7.3,3152,"Allan Hawco, Krystin Pellerin, Marthe Bernard, Mark O'Brien, Sean McGinley, Lynda Boyd, Bob Cole, Steve O'Connell, Sean Panting, Rachel Wilson",A pair of father and son private investigators tries to keep their combustible personal lives in check while tackling an intriguing array of cases.,1,1,1,0,0,0,0,0,0,0,0,0,0,0,0
How to Get Away with Murder,ABC,US,TV-14,2014-09-25,5,Ended,8.1,123007,"Viola Davis, Billy Brown, Alfred Enoch, Jack Falahee, Katie Findlay, Aja Naomi King, Matt McGorry, Karla Souza, Charlie Weber, Liza Weil","Brilliant criminal defense attorney and law professor Annalise Keating, plus five of her students, become involved in a twisted murder case.",0,1,1,0,0,0,0,0,0,0,0,0,0,1,0
Trailer Park Boys,Netflix,CA,TV-MA,2001-04-22,12,To Be Determined,8.4,36575,"Mike Smith, John Paul Tremblay, Robb Wells, John Dunsworth, Patrick Roach, Cory Bowles, Lucy Decoutere, Barrie Dunn, Sarah Dunsworth, Jeanna Harrison, Michael Jackson, Garry James, Tyrone Parsons, Shelley Thompson, Jonathan Torrens",Follow the booze-fueled misadventures of three longtime pals and petty serial criminals who run scams from their Nova Scotia trailer park.,0,1,0,0,0,0,0,0,0,0,0,0,0,0,0
On My Block,Netflix,US,TV-14,2018-03-16,2,To Be Determined,8.1,9944,"Sierra Capri, Jason Genao, Brett Gray, Diego Tinoco, Julio Macias, Jessica Marie Garcia, Ronni Hawk, Peggy Ann Blow, Paula Garcés, Danny Ramirez","In a rough inner-city Los Angeles neighborhood, four smart, funny and streetwise teens find their lifelong friendship tested as they begin high school.",1,0,1,0,0,0,0,1,0,0,0,0,0,0,0
Santa Clarita Diet,Netflix,US,TV-MA,2017-02-03,3,Ended,7.8,55394,"Drew Barrymore, Timothy Olyphant, Liv Hewson, Skyler Gisondo",They're ordinary husband and wife realtors until she undergoes a dramatic change that sends them down a road of death and destruction. In a good way.,1,0,0,0,0,1,0,0,0,0,0,0,0,0,0
Versailles,Canal+,FR,TV-MA,2015-11-16,3,Ended,7.9,13276,"George Blagden, Alexander Vlahos, Tygh Runyan, Stuart Bowman, Evan Williams, Elisa Lasowski, Joe Sheridan, Steve Cumyn, Anna Brewster, Maddison Jaizani, Pip Torrens, Catherine Walker, Lizzie Brocheré, Geoffrey Bateman",King Louis XIV of France commissions a lavish palace that becomes a fierce battleground for love and politics – and a gilded prison for nobility.,0,0,1,0,0,0,0,0,0,0,0,0,0,0,0
Black Lightning,The CW,US,TV-14,2018-01-16,2,Running,6.1,20673,"Cress Williams, James Remar, Marvin 'Krondon' Jones III, Jill Scott, China Anne McClain, Damon Gupton, Nafessa Williams, Christine Adams",School principal and retired superhero Jefferson Pierce leaps back into action as the legendary Black Lightning after a gang threatens his family.,0,0,1,0,0,0,0,0,0,0,1,0,0,0,1
Better Call Saul,AMC,US,TV-MA,2015-02-08,3,Running,8.7,310219,"Bob Odenkirk, Jonathan Banks, Michael McKean, Rhea Seehorn, Patrick Fabian, Michael Mando, Giancarlo Esposito","This Emmy-nominated prequel to ""Breaking Bad"" follows small-time attorney Jimmy McGill as he transforms into morally challenged lawyer Saul Goodman.",1,1,1,0,0,0,0,0,0,0,0,0,0,0,0
The OA,Netflix,US,TV-MA,2016-12-16,2,Ended,7.9,87925,"Brit Marling, Jason Isaacs, Emory Cohen, Scott Wilson, Phyllis Smith, Alice Krige, Patrick Gibson, Brendan Meyer, Brandon Perea, Ian Alexander, Will Brill, Riz Ahmed, Paz Vega","Seven years after vanishing from her home, a young woman returns with mysterious new abilities and recruits five strangers for a secret mission.",0,0,1,0,0,0,0,0,0,0,0,0,0,1,1
Mad Men,AMC,US,TV-14,2007-07-19,7,Ended,8.6,202344,"Jon Hamm, Elisabeth Moss, Vincent Kartheiser, January Jones, Christina Hendricks, Aaron Staton, Rich Sommer, John Slattery, Kiernan Shipka, Robert Morse, Michael Gladis, Christopher Stanley, Bryan Batt, Jared Harris, Jessica Paré, Alison Brie, Jay R. Ferguson, Ben Feldman, Mark Moses, Alexa Alemanni, Julie McNiven","Set in 1960s New York City, this award-winning series takes a peek inside an ad agency during an era when the cutthroat business had a glamorous lure.",0,0,1,0,0,0,0,0,0,0,0,0,0,0,0
The L Word,Showtime,US,TV-MA,2004-01-15,6,Ended,7.6,23800,"Jennifer Beals, Leisha Hailey, Laurel Holloman, Mia Kirshner, Katherine Moennig, Pam Grier, Rachel Shelley, Daniela Sea, Erin Daniels, Marlee Matlin",This trailblazing series follows the tangled lives and ever-changing relationships among a close-knit group of lesbians who call Los Angeles home.,0,0,1,0,0,0,0,1,0,0,0,0,0,0,0
Outback Truckers,7mate,AU,TV-14,2012-10-20,3,Running,7.5,183,Unknown,"Australia's toughest big-rig drivers brave wildfires, scorching deserts, treacherous downpours and chassis-deep mud to deliver their cargo on time.",0,0,0,0,0,0,0,0,0,0,0,0,1,0,0
Happy Valley,BBC One,UK,TV-MA,2014-04-29,2,To Be Determined,8.4,32744,"Sarah Lancashire, Siobhan Finneran, Charlie Murphy, James Norton, George Costigan, Karl Davies, Shane Zaza, Steve Pemberton, Joe Armstrong, Adam Long, Rick Warden, Rhys Connah, Katherine Kelly","Yorkshire police sergeant Catherine Cawood pursues the man who assaulted her late daughter, unaware he is now part of a secret kidnapping plot.",0,1,0,0,0,0,0,0,0,1,0,0,0,0,0
Brain Games,National Geographic Channel,US,TV-G,2011-10-09,3,Running,8.3,2941,Jason Silva,"This interactive series uses games, illusions and experiments to illustrate how our brains manufacture our reality and often play tricks on us.",0,0,0,1,0,0,0,0,1,0,0,0,0,0,0
Into the Badlands,AMC,US,NR,2015-11-15,3,Ended,8.0,40299,"Daniel Wu, Emily Beecham, Sarah Bolger, Oliver Stark, Orla Brady, Ally Ioannides, Stephen Lang, Marton Csokas, Madeleine Mantock, Aramis Knight","Dreaming of escaping to a distant city, a ferocious warrior and a mysterious boy tangle with territorial warlords and their highly trained killers.",0,0,0,0,0,0,0,0,0,0,1,0,0,0,0
Larva Island,Netflix,US,TV-Y7,2018-10-19,2,Running,6.3,307,"Hong Bum-ki, Eddy Lee, Ahn Hyo-min, Kang Shi-hyun, Tom Wayland, Erica Schroeder","Stranded on a tropical island, two silly larva buddies find slapstick fun in everything from discovering food to meeting new animal friends.",1,0,0,0,0,0,1,0,0,0,0,0,0,0,0
Murder Maps,Yesterday,GB,TV-MA,2015-11-24,3,To Be Determined,7.5,418,Nicholas Day,Dramatic reenactments paired with archival sources artfully illustrate how police brought some of Britain's most infamous killers to justice.,0,1,0,1,0,0,0,0,0,1,0,0,0,0,0
Marcella,ITV,GB,TV-MA,2016-04-04,2,Running,7.4,22363,"Anna Friel, Nicholas Pinnock, Sinéad Cusack, Nina Sosanya, Harry Lloyd, Laura Carmichael, Maeve Dermody, Ray Panthaki, Ian Puleston-Davies, Patrick Baladi, Florence Pugh, Jamie Bamber, Charlie Covell, Andrew Lancel, Jack Doolan, Tobias Santelmann, Stephen Lord, Ben Cura, Imogen Faires","Her marriage just ended and she's returning to work as a London detective after 12 years away. Is the serial killer she once investigated back, too?",0,1,0,0,0,0,0,0,0,1,0,0,0,0,0
3%,Netflix,US,TV-MA,2016-11-25,3,Ended,7.4,20920,"João Miguel, Bianca Comparato, Michel Gomes, Rodolfo Valente, Vaneza Oliveira, Rafael Lozano, Viviane Porto, Mel Fronckowiak, Sergio Mamberti, Zezé Motta, Celso Frateschi","In a future where the elite inhabit an island paradise far from the crowded slums, you get one chance to join the 3% saved from squalor.",0,0,1,0,0,0,0,0,0,0,0,0,0,0,1
Designated Survivor,Netflix,US,TV-14,2016-09-21,3,Ended,7.5,73183,"Kiefer Sutherland, Natascha McElhone, Maggie Q, Kal Penn, Adan Canto, Italia Ricci, LaMonica Garrett, Tanner Buchanan, Ben Lawson, Paulo Costanzo, Zoe McLellan",America's fate rests in the hands of a low-level official after an attack on Washington decimates the government in this gripping political thriller.,0,1,1,0,0,0,0,0,0,0,0,0,0,0,0
The Night Shift,NBC,US,TV-14,2014-05-27,4,Ended,7.4,10697,"Eoin Macken, Jill Flint, Freddy Rodríguez, Ken Leung, Brendan Fehr, Jeananne Goossen, J.R. Lemon, Robert Bailey Jr., Daniella Alonso, Catharine Pilafas","After returning from a dangerous tour of duty, an Army doctor finds that working the night shift at a San Antonio hospital can be treacherous, too.",0,0,1,0,0,0,0,0,0,0,0,0,0,0,0
Black Mirror,Netflix,UK,TV-MA,2011-12-04,5,To Be Determined,8.8,424594,"Jesse Plemons, Cristin Milioti, Jimmi Simpson, Rosemarie DeWitt, Douglas Hodge, Andrea Riseborough, Brenna Harding, Owen Teague, Andrew Gower, Kiran Sonia Sawar, Georgina Campbell, Joe Cole, Maxine Peake, Jake Davies, Clint Dyer, Letitia Wright, Babs Olusanmokun, Bryce Dallas Howard, Alice Eve, Michael Kelly, Cherry Jones, Gugu Mbatha-Raw, Mackenzie Davis, Wyatt Russell, Benedict Wong, Kelly Macdonald, Faye Marsay, Madeline Brewer, Hannah John-Kamen, Malachi Kirby, Alex Lawther, Jerome Flynn, James Norton, Rory Kinnear, Lindsay Duncan, Daniel Kaluuya, Jessica Brown Findlay, Rupert Everett, Toby Kebbell, Jodie Whittaker, Hayley Atwell, Domhnall Gleeson, Lenora Crichlow, Michael Smiley, Daniel Rigby, Chloe Pirrie, Jason Flemyng, Jon Hamm, Oona Chaplin, Rafe Spall","This sci-fi anthology series explores a twisted, high-tech near-future where humanity's greatest innovations and darkest instincts collide.",0,0,1,0,0,0,0,0,0,1,0,0,0,0,0
Madam Secretary,CBS,US,TV-14,2014-09-21,5,Ended,7.6,19609,"Téa Leoni, Tim Daly, Bebe Neuwirth, Zeljko Ivanek, Erich Bergen, Patina Miller, Geoffrey Arend, Kathrine Herzer, Evan Roe, Wallis Currie-Wood","When a highly capable woman becomes secretary of state, she struggles to find balance between the demands of world politics and those of her family.",0,0,1,0,0,0,0,0,0,0,0,0,0,0,0
Little Witch Academia,,JP,TV-Y7,Mar/02/2013,2,Ended,7.9,2221,"Megumi Han, Fumiko Orikasa, Michiyo Murase, Yoko Hikasa, Arisa Shida, Rie Murakawa, Reina Ueda, Ryosuke Kanemoto, Junko Takeuchi, Noriko Hidaka","Akko enrolls at the Luna Nova Witchcraft Academy. She's not the best student, but her bright attitude is the key to her and her friends' success.",0,0,0,0,0,0,0,0,0,0,0,1,0,0,0
Documentary Now!,IFC,US,TV-14,2015-08-20,3,Running,8.1,5185,"Fred Armisen, Bill Hader, Helen Mirren","Elevating the art of parody, this sharply comic series spoofs high-profile documentaries such as ""Grey Gardens"" and ""The Thin Blue Line.""",1,0,0,0,0,0,0,0,0,0,0,0,0,0,0
Dynasty,The CW,US,TV-14,2017-10-11,2,Running,6.2,6373,"Elizabeth Gillies, Nathalie Kelley, Grant Show, James Mackay, Rafael De La Fuente, Alan Dale, Sam Adegoke, Robert Christopher Riley",The Carringtons and the Colbys feud for control over their fortune – and their children – in this updated reboot of the classic prime-time soap.,0,0,1,0,0,0,0,0,0,0,0,0,0,0,0
Instant Hotel,7plus,AU,TV-MA,2017-11-07,2,Running,7.3,1114,"Luke Jacobz, Juliet Ashworth",Teams of Australian homeowners compete for the title of best Instant Hotel by staying overnight in each other's rentals and rating their experience.,0,0,0,0,0,0,0,0,0,0,0,0,1,0,0
Paquita Salas,Flooxer,US,TV-MA,2016-07-06,3,Running,8.0,2295,"Brays Efe, Belén Cuesta, Lidia San José, Álex de Lucas, Mariona Terés","One of Spain's best talent agents in the '90s, Paquita now finds herself searching desperately for new stars after suddenly losing her biggest client.",1,0,0,0,0,0,0,0,0,0,0,0,0,0,0
Slasher,Netflix,US,TV-MA,2016-03-04,3,Running,6.7,10970,"Katie McGrath, Brandon Jay McLaren, Steve Byers, Dean McDermott, Patrick Garrow, Jessica Sipos, Enuka Okuma, Leslie Hope, Lovell Adams-Gray, Christopher Jacot, Paulino Nunes, Ty Olsson, Joanne Vannicola, Sebastian Pigott, Madison Cheeatow, Melinda Shankar, Kaitlyn Leeb, Rebecca Liddiard, Jefferson Brown, Jim Watson, Paula Brancati, Aaron Martin",Rampaging serial killers leave carnage in their wake as their next victims fight to stay alive in this horror anthology series.,0,0,0,0,0,1,0,0,0,0,0,0,0,1,0
Heavy Rescue: 401,Discovery Channel,CA,TV-MA,2016-10-10,2,Running,7.0,225,Dave Pettitt,"In the harshest weather, rookie and veteran heavy recovery operators fight to keep southern Ontario's busy, treacherous highways clear and safe.",0,0,0,0,0,0,0,0,0,0,0,0,1,0,0
Dark,Netflix,US,TV-MA,2017-12-01,2,Ended,8.8,261115,"Louis Hofmann, Oliver Masucci, Jördis Triebel, Maja Schöne, Karoline Eichhorn, Sebastian Rudolph, Anatole Taubman, Mark Waschke, Stephan Kampwirth, Anne Ratte-Polle, Andreas Pietschmann, Lisa Vicari, Michael Mendl, Angela Winkler",A missing child sets four families on a frantic hunt for answers as they unearth a mind-bending mystery that spans three generations.,0,1,1,0,0,0,0,0,0,0,0,0,0,0,0
Magi: The Labyrinth of Magic,MBS,JP,TV-14,Oct/07/2012,2,Canceled/Ended,7.8,2892,"Kaori Ishihara, Yuki Kaji, Haruka Tomatsu, Daisuke Ono, Ryohei Kimura, Yoshimasa Hosoya, Takahiro Sakurai, Showtaro Morikubo, Yui Horie, Tomokazu Sugita",A land of mysterious ruins and a magical treasure hunt await young Aladdin and his courageous friend Alibaba for the adventure of their lives.,0,0,0,0,0,0,0,0,0,0,0,1,0,0,0
The Confession Tapes,Netflix,US,TV-MA,2017-09-08,2,To Be Determined,7.5,4617,Unknown,"This true crime documentary series investigates cases where people convicted of murder claim their confessions were coerced, involuntary or false.",0,1,0,1,0,0,0,0,0,0,0,0,0,0,0
Pac-Man and the Ghostly Adventures,DiSNEY XD,US,TV-Y7,Jun/15/2013,2,Returning Series,4.8,478,"Erin Mathews, Sam Vincent, Andrea Libman, Ashleigh Ball, Ian James Corlett, Brian Drummond, Lee Tockar, Matt Hill",Teenage Pac and his loyal crew face the ups and downs of adolescence while protecting Pac-World from a ghostly army led by the evil Betrayus.,1,0,0,0,0,0,1,0,0,0,0,0,0,0,0
Flaked,Netflix,US,TV-MA,2016-03-11,2,Ended,7.2,10171,"Will Arnett, David Sullivan, Ruth Kearney, George Basil, Lina Esco, Travis Mills, Robert Wisdom, Mark Boone Junior, Matthew Willig, Heather Graham, Kirstie Alley, Sab Shimono, Christopher Mintz-Plasse, Minerva Garcia, Jeff Daniel Phillips","In his funky California beach enclave, Chip's the go-to guy for personal insights. But he isn't quite as enlightened when it comes to his own baggage.",1,0,1,0,0,0,0,0,0,0,0,0,0,0,0
Aquarius,NBC,US,TV-MA,2015-05-28,2,Ended,7.1,10953,"David Duchovny, Gethin Anthony, Grey Damon, Emma Dumont, Claire Holt, Michaela McManus, Brían F. O'Byrne, David Meunier, Ambyr Childers, Tara Lynne Barr, Whitney Rose Pynn, Jason Ralph","Amid the turmoil of 1960s LA, two cops and a prominent political family are drawn into the sex- and drug-fueled web of a young Charles Manson.",0,1,1,0,0,0,0,0,0,0,0,0,0,0,0
Fate/Zero,Tokyo MX,JP,TV-MA,2011-10-01,2,Ended,8.3,9622,"Rikiya Koyama, Ayako Kawasumi, Sayaka Ohara, Sho Hayami, Tomokazu Seki, Jouji Nakata, Akina Abe, Takumi Yamasaki, Hikaru Midorikawa, Daisuke Namikawa","After three unsettled battles for the mystical Holy Grail, an artifact that grants a miracle to those who hold it, a fourth war begins.",0,0,0,0,0,0,0,0,0,0,0,1,0,0,0
Grey's Anatomy,ABC,US,TV-14,2005-03-27,15,Running,7.6,241582,"Ellen Pompeo, Sandra Oh, Katherine Heigl, Justin Chambers, Patrick Dempsey, Chandra Wilson, T.R. Knight, James Pickens Jr., Isaiah Washington, Sara Ramirez, Eric Dane, Chyler Leigh, Kate Walsh, Kevin McKidd, Jessica Capshaw",Intern (and eventual resident) Meredith Grey finds herself caught up in personal and professional passions with fellow doctors at a Seattle hospital.,0,0,1,0,0,0,0,1,0,0,0,0,0,0,0
Aggretsuko,Netflix,US,TV-14,2018-04-20,2,To Be Determined,8.0,4586,"Kaolip, Komegumi Koiwasaki, Maki Tsuruta, Sohta Arai, Rina Inoue, Shingo Kato, Yuki Takahashi","Frustrated with her thankless office job, Retsuko the Red Panda copes with her daily struggles by belting out death metal karaoke after work.",0,0,0,0,0,0,0,0,0,0,0,1,0,0,0
Girlfriends' Guide to Divorce,Bravo,US,TV-14,2014-12-02,5,Ended,6.9,3806,"Lisa Edelstein, Beau Garrett, Necar Zadegan, Paul Adelstein, Janeane Garofalo, Alanna Ubach","After the world learns the truth about her failing marriage, a successful self-help author tries to salvage her career and find her way as a divorcée.",1,0,1,0,0,0,0,0,0,0,0,0,0,0,0
Marlon,NBC,AU,TV-PG,2017-08-16,2,Ended,7.0,3330,"Marlon Wayans, Essence Atkins, Bresha Webb, Diallo Riddle, Notlim Taylor, Amir O'Neil","After the friendliest divorce ever, a carefree but devoted father navigates post-split parenting life with his levelheaded ex-wife and two kids.",1,0,0,0,0,0,0,0,0,0,0,0,0,0,0
Kakegurui,MBS,JP,TV-14,2018-01-14,2,Ended,7.2,3721,"Saori Hayami, Minami Tanaka, Tatsuya Tokutake, Yuki Wakai, Karin Nanami, Mariya Ise, Yu Serizawa, Tomokazu Sugita, Mayu Udono, Ayaka Fukuhara, Miyuki Sawashiro","High roller Yumeko Jabami plans to clean house at Hyakkaou Private Academy, a school where students are evaluated solely on their gambling skills.",0,0,0,0,0,0,0,0,0,0,0,1,0,0,0
Dawn of the Croods,Netflix,US,TV-Y7,2015-12-25,4,Ended,6.0,484,"Stephanie Lemelin, A.J. LoCascio, Dan Milano, Grey DeLisle, Cree Summer, Laraine Newman, Chris Parnell, Ana Gasteyer, Dee Bradley Baker, Thomas Lennon, Dominic Catrambone","The world's first family is back for more laughs as they discover sports, sleepovers and other wonders in a world of exotic creatures and adventures.",0,0,0,0,0,0,1,0,0,0,0,0,0,0,0
Degrassi: Next Class,Family Channel,CA,TV-14,2016-01-04,4,Ended,6.9,2392,"Amanda Arcuri, Amir Bageria, Soma Bhatia, Jamie Bloch, Stefan Brogren, Chelsea Clark, Reiya Downs, Ana Golja, Nikki Gould, Ricardo Hoyos, Ehren Kassam, Andre Kim, Lyle Lettau, Spencer MacPherson, Eric Osborne, Dante Scott, Olivia Scriven, Sara Waisglass, Richard Walters","Degrassi's next generation of high-tech newbies and returning students navigates real-world high school drama. If you're a teen, this is your life.",0,0,1,0,1,0,0,0,0,0,0,0,0,0,0
Free Rein,Netflix,US,TV-G,2017-06-23,3,Running,7.3,1554,"Jaylen Barron, Manpreet Bambra, Celine Buckens, Freddy Carter, Caroline Ford, Natalie Gumede, Bruce Herbelin-Earle, Noah Huntley, Kerry Ingram, Paul Luebke, Geoffrey McGivern, Navia Ziraili Robinson, Milo Twomey, Carla Woodcock","A 15-year-old from LA spends the summer at her mom's childhood home on an island off the coast of England, where she bonds with a mysterious horse.",0,0,1,0,0,0,1,0,0,1,0,0,0,0,0
Stranger Things,Netflix,US,TV-14,2016-07-15,3,Running,8.8,781516,"Winona Ryder, David Harbour, Finn Wolfhard, Millie Bobby Brown, Gaten Matarazzo, Caleb McLaughlin, Natalia Dyer, Charlie Heaton, Cara Buono, Noah Schnapp, Matthew Modine, Joe Keery, Dacre Montgomery, Sadie Sink, Paul Reiser, Sean Astin","When a young boy vanishes, a small town uncovers a mystery involving secret experiments, terrifying supernatural forces and one strange little girl.",0,0,0,0,0,1,0,0,0,0,0,0,0,1,1
Kuromukuro,AT-X,JP,TV-14,2016-04-07,2,Ended,7.2,1070,"Yohei Azakami, M・A・O, Reina Ueda, Asami Seto, Kaito Ishikawa, Yusuke Kobayashi, Shunsuke Takeuchi, Manami Sugihira, Momo Asakura, Kanako Tojo, Ryohei Kimura, Hikaru Ueda, Taiten Kusunoki","When mecha attack a research center, its students, pilots, and researchers must fight back with the help of mysterious artifacts and a young samurai.",0,0,0,0,0,0,0,0,0,0,0,1,0,0,0
The Letdown,ABC,AU,TV-MA,2017-10-25,2,To Be Determined,7.5,2597,"Alison Bell, Duncan Fellows, Noni Hazlehurst, Sacha Horler, Leon Ford, Lucy Durack, Leah Vandenberg, Celeste Barber, Xana Tang, Patrick Brammall","Audrey, mother of a 2-month-old, joins a new-parents support group, where she makes some quirky friends facing various challenges and life changes.",1,0,1,0,0,0,0,0,0,0,0,0,0,0,0
El Chapo,Univision,US,TV-MA,2017-04-23,3,Ended,7.8,14046,"Marco de la O, Humberto Busto, Alejandro Aguilar, Rodrigo Abed, Luis Fernando Peña, Juan Carlos Olivas, Rolf Petersen, Carlos Hernan Romo, Héctor Holten, Diego Vásquez, Teté Espinoza, Luis Rábago, Dolores Heredia, Cristina Michaus, Valentina Acosta, Juliette Pardau, Abril Schreiber","This drama series chronicles the true story of the rise, capture and escape of notorious Mexican drug lord Joaquín ""El Chapo"" Guzmán.",0,1,0,0,0,0,0,0,0,0,1,0,0,0,0
My First First Love,Netflix,US,TV-PG,2019-04-18,2,Ended,7.6,1202,"Ji Soo, Jung Chae-yeon, Jinyoung, Choi Ri, Kang Tae-oh, Hong Ji-yoon","Due to various personal reasons, a group of Yun Tae-o’s friends move into his house, where they experience love, friendship, and everything in between.",0,0,0,0,0,0,0,1,0,0,0,0,0,0,0
Orange Is the New Black,Netflix,US,TV-MA,2013-07-11,7,Ended,8.1,275519,"Taylor Schilling, Kate Mulgrew, Laura Prepon, Jason Biggs, Natasha Lyonne, Michael Harney, Uzo Aduba, Danielle Brooks, Samira Wiley, Dascha Polanco, Selenis Leyva, Nick Sandow, Yael Stone, Taryn Manning, Lea DeLaria, Matt McGorry, Emma Myles, Vicky Jeudy, Laverne Cox, Pablo Schreiber, Lori Petty, Ruby Rose, Adrienne C. Moore, Jackie Cruz, Elizabeth Rodriguez","A privileged New Yorker ends up in a women's prison when a past crime catches up with her in this Emmy-winning series from the creator of ""Weeds.""",1,0,1,0,0,0,0,0,0,0,0,0,0,0,0
Sugar Rush,Netflix,US,TV-PG,2018-07-13,2,Running,7.7,3845,"Candace Nelson, Adriano Zumbo, Hunter March",Time's the most important ingredient as teams race against the clock – and each other – to bake up the best-tasting sweets.,0,0,0,0,0,0,0,0,0,0,0,0,1,0,0
The Worst Witch,CBBC,GB,TV-Y7,2017-01-11,3,To Be Determined,7.2,1429,"Bella Ramsey, Clare Higgins, Meibh Campbell, Raquel Cassidy, Jenny Richardson, Miriam Petche, Tallulah Milligan, Wendy Craig, Shauna Shim","After stumbling into a school for witches, a bumbling heroine comes to realize that she just might belong there. Based on Jill Murphy's beloved books.",0,0,0,0,0,0,1,0,0,1,0,0,0,0,0
